{
  "topic_slug": "crypto",
  "date_key": "2025-01-15",
  "asset_type": "daily_post",
  "source_type": "daily_summary",
  "source_id": null,
  "publish_job_id": 42,
  "ai_output": {
    "post_caption": "Bitcoin ETF inflows hit a record $500M in a single session as institutional demand accelerates. BTC briefly touched the $50K level before settling at $49,400. Ethereum ETFs also recorded their second-best inflow day since approval, signalling broad institutional appetite across the crypto market.",
    "hashtags": [
      "#crypto",
      "#bitcoin",
      "#BTC",
      "#ethereum",
      "#ETH",
      "#ETF",
      "#institutionalcrypto",
      "#cryptonews",
      "#blockchain",
      "#digitalassets"
    ],
    "image_prompt": "Professional financial chart showing Bitcoin price rally with upward trend line, dark background with orange Bitcoin symbol, clean modern style",
    "story_caption": "BTC ETFs record $500M single-day inflows 🚀 Bitcoin touches $50K",
    "story_background_hint": "Dark gradient with orange Bitcoin symbol and upward arrow",
    "cta": "Full daily crypto briefing — link in bio."
  },
  "x": {
    "enabled": true,
    "post_text": "🪙 Bitcoin ETF inflows hit a record $500M in a single session as institutional demand accelerates. BTC briefly touched the $50K level before settling at $49,400.\n\n#crypto #bitcoin #BTC #ethereum #ETH",
    "thread": null,
    "alert_text": null
  },
  "telegram": {
    "enabled": true,
    "message_html": "🪙 <b>Crypto Daily Briefing</b> — 2025-01-15\n\nBitcoin ETF inflows hit a record $500M in a single session as institutional demand accelerates. BTC briefly touched the $50K level before settling at $49,400. Ethereum ETFs also recorded their second-best inflow day since approval, signalling broad institutional appetite across the crypto market.\n\nFull daily crypto briefing — link in bio.\n\n#crypto #bitcoin #BTC #ethereum #ETH #ETF #institutionalcrypto #cryptonews #blockchain #digitalassets #web3",
    "alert_html": null
  },
  "discord": {
    "enabled": true,
    "embed": {
      "title": "🪙 Crypto Daily Briefing — 2025-01-15",
      "description": "Bitcoin ETF inflows hit a record $500M in a single session as institutional demand accelerates. BTC briefly touched the $50K level before settling at $49,400. Ethereum ETFs also recorded their second-best inflow day since approval, signalling broad institutional appetite across the crypto market.",
      "color": 16159514,
      "fields": [
        { "name": "Topic", "value": "Crypto", "inline": true },
        { "name": "CTA", "value": "Full daily crypto briefing — link in bio.", "inline": false }
      ],
      "footer": { "text": "#crypto #bitcoin #BTC #ethereum #ETH #ETF #institutionalcrypto #cryptonews #blockchain #digitalassets" },
      "timestamp": "2025-01-15T23:45:00Z"
    },
    "alert_embed": null
  },
  "generated_at": "2025-01-15T23:45:00Z"
}
